{
  "id": "pagination",
  "description": "Practice navigating paginated output with SPACE, ENTER, and Q",
  "deviceModel": "2960-switch",
  "commands": ["enable", "show running-config"],
  "validation": {
    "type": "exploratory",
    "assertions": [
      {
        "type": "command_succeeded",
        "message": "Show running-config command executed successfully"
      }
    ]
  }
}
