{
  "id": "tab-completion",
  "description": "Practice using TAB completion for commands",
  "deviceModel": "2960-switch",
  "commands": ["enable", "configure terminal"],
  "validation": {
    "type": "exploratory",
    "assertions": [
      {
        "type": "mode_reached",
        "expected": "GLOBAL_CONFIG",
        "message": "Should reach global configuration mode to practice TAB completion"
      }
    ]
  }
}
