{
  "id": "sub-config-modes",
  "description": "Practice navigating different sub-configuration modes (VLAN and interface)",
  "deviceModel": "2960-switch",
  "commands": [
    "enable",
    "configure terminal",
    "vlan 100",
    "exit",
    "interface vlan 1",
    "exit",
    "vlan 100",
    "end"
  ],
  "validation": {
    "type": "exploratory",
    "assertions": [
      {
        "type": "vlan_exists",
        "vlanId": "100",
        "message": "VLAN 100 should be created during sub-config mode practice"
      }
    ]
  }
}

