{
  "id": "password-entry",
  "description": "Practice password entry with no visual feedback",
  "deviceModel": "2960-switch",
  "commands": [
    "enable",
    "configure terminal",
    "enable secret C1sc0R0ck$",
    "end",
    "disable",
    "enable"
  ],
  "validation": {
    "type": "exploratory",
    "assertions": [
      {
        "type": "enable_secret",
        "message": "Enable secret should be configured to practice password entry"
      }
    ]
  }
}
