{
  "id": "name-lookup-abort",
  "description": "Practice aborting DNS name lookups with CTRL+SHIFT+6",
  "deviceModel": "2960-switch",
  "commands": [
    "end",
    "test",
    "hello"
  ],
  "validation": {
    "type": "exploratory",
    "assertions": [
      {
        "type": "command_succeeded",
        "message": "Practice commands for name lookup abortion"
      }
    ]
  }
}

